{
  "schema_version": "0.1.0",
  "calibration_id": "b2c3d4e5-f6a1-4b2c-9d3e-4f5a6b7c8d9e",
  "component_instance_id": "fixture-001",
  "kind": "work_frame",
  "created_at": "2026-08-19T00:00:00Z",
  "valid_until": "2027-08-19T00:00:00Z",
  "data": {
    "frame_id": "fixture_root",
    "origin": [0.35, 0.1, 0.12],
    "rotation_rpy": [0.0, 0.0, 0.0]
  },
  "sha256": "5c684534f590d65b75010ca45b4cbf4d8e578ad45c088cce606e902f43cbbbbb"
}
